{
  "schema_version": "1.0.0",
  "review_version": "real-world-gold-review-v1",
  "reviewer_mode": "FRESH_CORPUS_EVIDENCE_PASS",
  "verification_scope": {
    "structural_contract_validation": true,
    "frozen_corpus_locator_revalidation": true,
    "anchor_hash_recomputation": true,
    "independent_semantic_rejudgment_performed": false
  },
  "draft_file_sha256": "1b2a90390718644292d5e8b379d03de3f73f6964d7d3a013c780bc2761bb54ff",
  "review_count": 72,
  "verified_count": 72,
  "reviews": [
    {
      "case_id": "rw-gold-v1-single-bge-shape",
      "verification_status": "VERIFIED",
      "review_reason": "Deterministic contract structure and frozen-corpus anchor binding passed; claim semantics were not independently re-judged.",
      "reviewer_mode": "FRESH_CORPUS_EVIDENCE_PASS",
      "review_version": "real-world-gold-review-v1",
      "checks": {
        "question_field_present": true,
        "answerability_contract_structure_valid": true,
        "claim_group_references_resolve": true,
        "evidence_anchors_recomputed": true,
        "evidence_role_sets_disjoint": true,
        "citation_contract_structurally_valid": true,
        "case_type_structurally_valid": true,
        "duplicate_question_heuristics_passed": true,
        "independent_semantic_rejudgment_performed": false
      },
      "claim_reviews": [
        {
          "claim_id": "rw-gold-v1-single-bge-shape-claim-01",
          "binding_status": "EVIDENCE_GROUP_BINDING_VERIFIED",
          "semantic_rejudgment": "NOT_PERFORMED",
          "evidence_group_ids": [
            "eg-rw-single-bge-shape-01"
          ],
          "rationale": "Claim references resolve to evidence groups whose frozen-source locators and hashes were recomputed; semantic support was not independently re-judged."
        },
        {
          "claim_id": "rw-gold-v1-single-bge-shape-claim-02",
          "binding_status": "EVIDENCE_GROUP_BINDING_VERIFIED",
          "semantic_rejudgment": "NOT_PERFORMED",
          "evidence_group_ids": [
            "eg-rw-single-bge-shape-01"
          ],
          "rationale": "Claim references resolve to evidence groups whose frozen-source locators and hashes were recomputed; semantic support was not independently re-judged."
        }
      ],
      "evidence_reviews": [
        {
          "evidence_id": "ev-rw-bge-specs",
          "document_id": "rw-rag-bge-m3",
          "locator_kind": "SOURCE_LINES",
          "anchor_hash_recomputed": "a6e25219680dd3d03855888dc4be1e380ba273f8e8c5d70d8d4ec9be0d866c3f",
          "locator_resolution": "PASS",
          "source_binding_status": "PASS"
        }
      ]
    },
    {
      "case_id": "rw-gold-v1-single-dependency-defaults",
      "verification_status": "VERIFIED",
      "review_reason": "Deterministic contract structure and frozen-corpus anchor binding passed; claim semantics were not independently re-judged.",
      "reviewer_mode": "FRESH_CORPUS_EVIDENCE_PASS",
      "review_version": "real-world-gold-review-v1",
      "checks": {
        "question_field_present": true,
        "answerability_contract_structure_valid": true,
        "claim_group_references_resolve": true,
        "evidence_anchors_recomputed": true,
        "evidence_role_sets_disjoint": true,
        "citation_contract_structurally_valid": true,
        "case_type_structurally_valid": true,
        "duplicate_question_heuristics_passed": true,
        "independent_semantic_rejudgment_performed": false
      },
      "claim_reviews": [
        {
          "claim_id": "rw-gold-v1-single-dependency-defaults-claim-01",
          "binding_status": "EVIDENCE_GROUP_BINDING_VERIFIED",
          "semantic_rejudgment": "NOT_PERFORMED",
          "evidence_group_ids": [
            "eg-rw-single-dependency-defaults-01"
          ],
          "rationale": "Claim references resolve to evidence groups whose frozen-source locators and hashes were recomputed; semantic support was not independently re-judged."
        },
        {
          "claim_id": "rw-gold-v1-single-dependency-defaults-claim-02",
          "binding_status": "EVIDENCE_GROUP_BINDING_VERIFIED",
          "semantic_rejudgment": "NOT_PERFORMED",
          "evidence_group_ids": [
            "eg-rw-single-dependency-defaults-01"
          ],
          "rationale": "Claim references resolve to evidence groups whose frozen-source locators and hashes were recomputed; semantic support was not independently re-judged."
        }
      ],
      "evidence_reviews": [
        {
          "evidence_id": "ev-rw-deps-dependable",
          "document_id": "rw-backend-fastapi-dependencies",
          "locator_kind": "SOURCE_LINES",
          "anchor_hash_recomputed": "bfe30809cdd9dac0063dc67571f12ae32fccf15cc332b699682630bd88020aa5",
          "locator_resolution": "PASS",
          "source_binding_status": "PASS"
        }
      ]
    },
    {
      "case_id": "rw-gold-v1-single-error-response",
      "verification_status": "VERIFIED",
      "review_reason": "Deterministic contract structure and frozen-corpus anchor binding passed; claim semantics were not independently re-judged.",
      "reviewer_mode": "FRESH_CORPUS_EVIDENCE_PASS",
      "review_version": "real-world-gold-review-v1",
      "checks": {
        "question_field_present": true,
        "answerability_contract_structure_valid": true,
        "claim_group_references_resolve": true,
        "evidence_anchors_recomputed": true,
        "evidence_role_sets_disjoint": true,
        "citation_contract_structurally_valid": true,
        "case_type_structurally_valid": true,
        "duplicate_question_heuristics_passed": true,
        "independent_semantic_rejudgment_performed": false
      },
      "claim_reviews": [
        {
          "claim_id": "rw-gold-v1-single-error-response-claim-01",
          "binding_status": "EVIDENCE_GROUP_BINDING_VERIFIED",
          "semantic_rejudgment": "NOT_PERFORMED",
          "evidence_group_ids": [
            "eg-rw-single-error-response-01"
          ],
          "rationale": "Claim references resolve to evidence groups whose frozen-source locators and hashes were recomputed; semantic support was not independently re-judged."
        },
        {
          "claim_id": "rw-gold-v1-single-error-response-claim-02",
          "binding_status": "EVIDENCE_GROUP_BINDING_VERIFIED",
          "semantic_rejudgment": "NOT_PERFORMED",
          "evidence_group_ids": [
            "eg-rw-single-error-response-01"
          ],
          "rationale": "Claim references resolve to evidence groups whose frozen-source locators and hashes were recomputed; semantic support was not independently re-judged."
        }
      ],
      "evidence_reviews": [
        {
          "evidence_id": "ev-rw-errors-http-exception",
          "document_id": "rw-backend-fastapi-errors",
          "locator_kind": "SOURCE_LINES",
          "anchor_hash_recomputed": "7fe15bfbf116807e56ecc8ab43150c12ab017f419595de33d2f734157b604f62",
          "locator_resolution": "PASS",
          "source_binding_status": "PASS"
        }
      ]
    },
    {
      "case_id": "rw-gold-v1-single-faiss-cosine",
      "verification_status": "VERIFIED",
      "review_reason": "Deterministic contract structure and frozen-corpus anchor binding passed; claim semantics were not independently re-judged.",
      "reviewer_mode": "FRESH_CORPUS_EVIDENCE_PASS",
      "review_version": "real-world-gold-review-v1",
      "checks": {
        "question_field_present": true,
        "answerability_contract_structure_valid": true,
        "claim_group_references_resolve": true,
        "evidence_anchors_recomputed": true,
        "evidence_role_sets_disjoint": true,
        "citation_contract_structurally_valid": true,
        "case_type_structurally_valid": true,
        "duplicate_question_heuristics_passed": true,
        "independent_semantic_rejudgment_performed": false
      },
      "claim_reviews": [
        {
          "claim_id": "rw-gold-v1-single-faiss-cosine-claim-01",
          "binding_status": "EVIDENCE_GROUP_BINDING_VERIFIED",
          "semantic_rejudgment": "NOT_PERFORMED",
          "evidence_group_ids": [
            "eg-rw-single-faiss-cosine-01"
          ],
          "rationale": "Claim references resolve to evidence groups whose frozen-source locators and hashes were recomputed; semantic support was not independently re-judged."
        }
      ],
      "evidence_reviews": [
        {
          "evidence_id": "ev-rw-faiss-distance",
          "document_id": "rw-rag-faiss-overview",
          "locator_kind": "SOURCE_LINES",
          "anchor_hash_recomputed": "d2a992d14be11917fe80515dc75ced279801e1f48b2a783ec81bb7c268821c43",
          "locator_resolution": "PASS",
          "source_binding_status": "PASS"
        }
      ]
    },
    {
      "case_id": "rw-gold-v1-single-interrupt-status",
      "verification_status": "VERIFIED",
      "review_reason": "Deterministic contract structure and frozen-corpus anchor binding passed; claim semantics were not independently re-judged.",
      "reviewer_mode": "FRESH_CORPUS_EVIDENCE_PASS",
      "review_version": "real-world-gold-review-v1",
      "checks": {
        "question_field_present": true,
        "answerability_contract_structure_valid": true,
        "claim_group_references_resolve": true,
        "evidence_anchors_recomputed": true,
        "evidence_role_sets_disjoint": true,
        "citation_contract_structurally_valid": true,
        "case_type_structurally_valid": true,
        "duplicate_question_heuristics_passed": true,
        "independent_semantic_rejudgment_performed": false
      },
      "claim_reviews": [
        {
          "claim_id": "rw-gold-v1-single-interrupt-status-claim-01",
          "binding_status": "EVIDENCE_GROUP_BINDING_VERIFIED",
          "semantic_rejudgment": "NOT_PERFORMED",
          "evidence_group_ids": [
            "eg-rw-single-interrupt-status-01"
          ],